{
  "schemaVersion": 1,
  "id": "play_move_one_match",
  "revisionId": "rev_2",
  "format": "solve",
  "classification": "challenge",
  "topics": ["puzzles", "logic"],
  "learningTopics": [],
  "estimatedDurationSec": 35,
  "assets": ["puzzle_match_01", "puzzle_match_01_solved"],
  "sources": [],
  "entryState": "solve",
  "states": {
    "solve": {
      "presentation": {"layers": [
        {"type": "canvas", "role": "media", "assetId": "puzzle_match_01"},
        {"type": "text", "role": "prompt", "value": "Move one match."}
      ]},
      "input": {
        "type": "drag",
        "dragOrigin": {"x": 0.335, "y": 0.35},
        "dragSize": {"width": 0.03, "height": 0.14},
        "targets": [
          {"id": "solution_a", "x": 0.185, "y": 0.29, "width": 0.05, "height": 0.14}
        ],
        "handleLabel": "Move match",
        "handleStyle": "matchstick"
      },
      "validation": {"type": "target_region", "value": "solution_a"},
      "transition": {"correct": "reveal", "incorrect": "solve"}
    },
    "reveal": {
      "presentation": {"layers": [
        {"type": "canvas", "role": "media", "assetId": "puzzle_match_01_solved"},
        {"type": "text", "role": "reveal_title", "value": "8 − 4 = 4"}
      ]},
      "input": {"type": "tap", "label": "Done"},
      "validation": {"type": "none"},
      "transition": {"default": "$end"}
    }
  }
}
